{
  "aft_version": "0.1",
  "peer_id": "did:web:payments.example",
  "peer_name": "Example Payment Processor",
  "peer_type": ["payment_processor", "event_issuer"],
  "status": "active",
  "service_endpoints": {
    "events": "https://payments.example/aft/v1/events",
    "credentials": "https://payments.example/aft/v1/credentials",
    "revocation": "https://payments.example/aft/v1/revocations",
    "risk": "https://payments.example/aft/v1/risk",
    "anchors": "https://payments.example/aft/v1/anchors",
    "attestations": "https://payments.example/aft/v1/attestations"
  },
  "supported_event_types": [
    "AGENT_PAYMENT_SETTLED",
    "AGENT_PAYMENT_FAILED",
    "AGENT_PAYMENT_CHARGEBACK_OPENED"
  ],
  "supported_credentials": [
    "AgentPaymentSettlementCredential",
    "AgentChargebackCredential"
  ],
  "supported_crypto_profiles": [
    "aft-sig-hybrid-ed25519-ml-dsa",
    "aft-sig-ml-dsa"
  ],
  "pqc_readiness_level": "AFT-PQC-2",
  "anchoring": {
    "mode": "merkle_batch",
    "supported_ledgers": ["base", "ethereum", "hyperledger-fabric"],
    "anchor_endpoint": "https://payments.example/aft/v1/anchors",
    "anchor_policy_hash": "sha256:4141414141414141414141414141414141414141414141414141414141414141"
  },
  "conformance": {
    "profiles": ["AFT-Core", "AFT-Events", "AFT-Anchoring", "AFT-PQC-Hybrid", "AFT-Peer-Discovery"],
    "test_report_hash": "sha256:4242424242424242424242424242424242424242424242424242424242424242",
    "test_report_url": "https://payments.example/aft/conformance/report-2026-05"
  },
  "privacy": {
    "default_disclosure": "hash_only",
    "pii_on_chain": false,
    "evidence_storage": "encrypted_off_chain",
    "privacy_policy_url": "https://payments.example/aft/privacy",
    "privacy_policy_hash": "sha256:4343434343434343434343434343434343434343434343434343434343434343"
  },
  "revocation": {
    "endpoint": "https://payments.example/aft/v1/revocations",
    "latest_revocation_root": "sha256:4444444444444444444444444444444444444444444444444444444444444444",
    "status_list_url": "https://payments.example/aft/status/payment-processor"
  },
  "terms": {
    "terms_url": "https://payments.example/aft/terms",
    "terms_hash": "sha256:4545454545454545454545454545454545454545454545454545454545454545",
    "policy_url": "https://payments.example/aft/policy",
    "policy_hash": "sha256:4646464646464646464646464646464646464646464646464646464646464646"
  },
  "created_at": "2026-05-04T13:00:00Z",
  "updated_at": "2026-05-04T13:30:00Z",
  "signatures": [
    {
      "alg": "aft-sig-hybrid-ed25519-ml-dsa",
      "kid": "payment-peer-hybrid-v1",
      "key_version": 1,
      "pqc_profile": "AFT-PQC-2",
      "signature_value": "HybridPaymentPeerDiscoverySignatureExample001",
      "verification_method": "did:web:payments.example#aft-hybrid-v1",
      "signature_created_at": "2026-05-04T13:30:01Z"
    }
  ]
}
